id,theme,likert,style,text
transparency_strongly_agree_142,transparency,strongly_agree,manifesto,This manifesto demands full transparency about every artwork and image included in artificial intelligence training datasets.
transparency_strongly_agree_143,transparency,strongly_agree,union_statement,Our statement insists that artificial intelligence companies must provide detailed lists of all visual works used in training.
transparency_strongly_agree_144,transparency,strongly_agree,policy_report,The report strongly recommends strict disclosure mandates covering all art and images used to train artificial intelligence models.
transparency_strongly_agree_145,transparency,strongly_agree,legal_brief,The brief argues that compulsory training data disclosure is essential to protect artists' rights.
transparency_strongly_agree_146,transparency,strongly_agree,blog_opinion,"According to this piece, anything less than full transparency about training images from artificial intelligence firms is unacceptable."
transparency_strongly_agree_147,transparency,strongly_agree,panel_statement,The panel's conclusion is that creators of artificial intelligence models must be legally required to detail their training image sources.
transparency_strongly_agree_148,transparency,strongly_agree,news_opinion,The editorial strongly supports laws forcing artificial intelligence developers to reveal their training datasets to the public.
transparency_strongly_agree_149,transparency,strongly_agree,academic_article,The article endorses robust disclosure obligations for all art and images used in artificial intelligence training pipelines.
transparency_strongly_agree_150,transparency,strongly_agree,advocacy_report,The advocacy report urges governments to mandate granular transparency about training images for artificial intelligence models.
threat_strongly_disagree_151,threat,strongly_disagree,first_person,I do not see artificial intelligence art models as a threat to art workers at all.
threat_strongly_disagree_152,threat,strongly_disagree,blog_opinion,This commentary insists that artificial intelligence art models pose no real danger to working artists.
threat_strongly_disagree_153,threat,strongly_disagree,industry_statement,Our organization strongly rejects the claim that artificial intelligence art models threaten creative jobs.
threat_strongly_disagree_154,threat,strongly_disagree,news_opinion,The editorial argues that fears about artificial intelligence art models destroying art careers are exaggerated and unfounded.
threat_strongly_disagree_155,threat,strongly_disagree,panel_discussion,"Several panelists said they see artificial intelligence art tools as benign, not as a menace to art workers."
threat_strongly_disagree_156,threat,strongly_disagree,interview_executive,"In the interview, the executive declares that artificial intelligence art systems will not replace professional artists."
threat_strongly_disagree_157,threat,strongly_disagree,policy_report,The report concludes that artificial intelligence art models are unlikely to displace significant numbers of art workers.
threat_strongly_disagree_158,threat,strongly_disagree,academic_article,"The paper contends that artificial intelligence art models complement, rather than threaten, human artistic labor."
threat_strongly_disagree_159,threat,strongly_disagree,first_person,"As far as I am concerned, artificial intelligence art models are not a danger to my livelihood as an artist."
threat_strongly_disagree_160,threat,strongly_disagree,industry_brief,The brief states that artificial intelligence assisted tools will create more opportunities than risks for art workers.
threat_disagree_161,threat,disagree,first_person,"Overall, I do not think artificial intelligence art models are a major threat to art workers, though some concerns exist."
threat_disagree_162,threat,disagree,panel_discussion,The panel acknowledged limited risks from artificial intelligence art systems but did not view them as a serious threat to jobs.
threat_disagree_163,threat,disagree,blog_opinion,This essay suggests that artificial intelligence art models may change workflows without necessarily endangering artists' careers.
threat_disagree_164,threat,disagree,news_report,The article notes that some experts doubt whether artificial intelligence art tools will significantly reduce employment for artists.
threat_disagree_165,threat,disagree,policy_brief,The brief argues that artificial intelligence art models should be monitored but are not inherently hostile to art workers.
threat_disagree_166,threat,disagree,interview_artist,"In this interview, the painter says they are not overly worried about artificial intelligence art systems taking their job."
threat_disagree_167,threat,disagree,academic_article,The paper suggests that artificial intelligence art models create new roles alongside existing artistic occupations.
threat_disagree_168,threat,disagree,survey_report,Survey respondents expressed moderate concern but did not overwhelmingly label artificial intelligence art models as a threat.
threat_disagree_169,threat,disagree,news_opinion,The column argues that traditional challenges such as low pay are more pressing than artificial intelligence art models for workers.
threat_disagree_170,threat,disagree,policy_report,The report recommends precautionary policies while concluding that artificial intelligence art models are not yet a major threat.
threat_neutral_171,threat,neutral,research_report,The report presents arguments both for and against the claim that artificial intelligence art models endanger art workers.
threat_neutral_172,threat,neutral,first_person,I am unsure whether artificial intelligence art models represent a real threat to art workers at this point.
threat_neutral_173,threat,neutral,panel_discussion,"Our panel heard contrasting views on whether artificial intelligence art tools will harm, help, or simply transform art jobs."
threat_neutral_174,threat,neutral,academic_article,The article analyzes potential risks and opportunities for art workers arising from artificial intelligence art systems.
threat_neutral_175,threat,neutral,news_report,The news story quotes some artists who fear displacement by artificial intelligence and others who do not.
threat_neutral_176,threat,neutral,survey_report,"Survey results show a mix of anxiety, curiosity, and indifference toward artificial intelligence art models among workers."
threat_neutral_177,threat,neutral,blog_opinion,This post notes that the long term impact of artificial intelligence art models on creative labor remains uncertain.
threat_neutral_178,threat,neutral,policy_brief,The brief outlines possible regulatory responses without labeling artificial intelligence art models as purely a threat or a benefit.
threat_neutral_179,threat,neutral,interview_curator,"In the interview, the curator says it is hard to predict whether artificial intelligence art will shrink or expand job opportunities."
threat_neutral_180,threat,neutral,legal_commentary,The commentary discusses labor concerns about artificial intelligence art models without taking a definitive stance.
threat_agree_181,threat,agree,first_person,I tend to agree that artificial intelligence art models pose a meaningful threat to some art workers.
threat_agree_182,threat,agree,blog_opinion,This essay argues that artificial intelligence art tools can undercut commissions that would otherwise go to human artists.
threat_agree_183,threat,agree,policy_report,The report warns that artificial intelligence art models may reduce demand for certain kinds of creative labor.
threat_agree_184,threat,agree,news_opinion,The column describes artificial intelligence art systems as a growing concern for illustrators and designers.
threat_agree_185,threat,agree,interview_artist,"In this interview, the freelancer says that artificial intelligence art generators have already taken away potential gigs."
threat_agree_186,threat,agree,panel_discussion,Several panelists agreed that artificial intelligence art models introduce serious competition for working artists.
threat_agree_187,threat,agree,survey_report,Survey data show that many art workers view artificial intelligence art tools as a significant career risk.
threat_agree_188,threat,agree,academic_article,The article concludes that artificial intelligence art models can exert downward pressure on wages for creative professionals.
threat_agree_189,threat,agree,union_statement,The union statement characterizes artificial intelligence art systems as a threat to stable employment in the arts.
threat_agree_190,threat,agree,policy_brief,The brief recommends protective measures for art workers in light of emerging artificial intelligence art technologies.
threat_strongly_agree_191,threat,strongly_agree,first_person,I am convinced that artificial intelligence art models are a serious threat to art workers' livelihoods.
threat_strongly_agree_192,threat,strongly_agree,manifesto,This manifesto denounces artificial intelligence art systems as an existential danger to creative labor.
threat_strongly_agree_193,threat,strongly_agree,union_statement,Our statement declares that artificial intelligence art models are a direct attack on working artists and their jobs.
threat_strongly_agree_194,threat,strongly_agree,news_opinion,The editorial warns that artificial intelligence art tools could wipe out entire categories of creative work.
threat_strongly_agree_195,threat,strongly_agree,policy_report,The report strongly asserts that artificial intelligence art models will displace many art workers unless regulations intervene.
threat_strongly_agree_196,threat,strongly_agree,blog_opinion,This piece argues passionately that artificial intelligence art systems are already undermining the economic basis of artistic careers.
threat_strongly_agree_197,threat,strongly_agree,interview_artist,"In the interview, the illustrator says that artificial intelligence art generators are the biggest threat they have ever faced."
threat_strongly_agree_198,threat,strongly_agree,academic_article,The article concludes that artificial intelligence art models represent a profound structural threat to creative employment.
threat_strongly_agree_199,threat,strongly_agree,panel_statement,The panel's closing statement affirms that artificial intelligence art systems are dangerously disruptive to art workers.
threat_strongly_agree_200,threat,strongly_agree,advocacy_report,The advocacy report urges urgent action against artificial intelligence art models that threaten artists' livelihoods.
compensation_strongly_disagree_201,compensation,strongly_disagree,first_person,I do not think artists need to be compensated when their work is used to train artificial intelligence art models.
compensation_strongly_disagree_202,compensation,strongly_disagree,blog_opinion,This commentary argues that companies should be free to profit from training data without paying artists.
compensation_strongly_disagree_203,compensation,strongly_disagree,corporate_statement,Our company takes the position that no royalties are owed to artists for artificial intelligence training uses.
compensation_strongly_disagree_204,compensation,strongly_disagree,legal_opinion,The opinion holds that artists have no financial claim on profits generated by artificial intelligence art systems.
compensation_strongly_disagree_205,compensation,strongly_disagree,policy_report,The report concludes that mandatory artist compensation for artificial intelligence training would be inappropriate.
compensation_strongly_disagree_206,compensation,strongly_disagree,industry_brief,The brief asserts that paying artists for every artificial intelligence use of their work is neither necessary nor desirable.
compensation_strongly_disagree_207,compensation,strongly_disagree,news_opinion,The column insists that artists should not expect profit sharing from artificial intelligence art products.
compensation_strongly_disagree_208,compensation,strongly_disagree,panel_discussion,Some panelists argued strongly against revenue sharing schemes for artists in artificial intelligence markets.
compensation_strongly_disagree_209,compensation,strongly_disagree,first_person,I see no reason why for profit companies should have to share artificial intelligence art profits with creators.
compensation_strongly_disagree_210,compensation,strongly_disagree,policy_memo,The memo recommends against any special taxes or funds to support artists from artificial intelligence related revenues.
compensation_disagree_211,compensation,disagree,first_person,I am not convinced that artists deserve extensive compensation every time their work informs artificial intelligence art models.
compensation_disagree_212,compensation,disagree,blog_opinion,"This essay suggests that only minimal payments, if any, should be made to artists for artificial intelligence training uses."
compensation_disagree_213,compensation,disagree,policy_brief,The brief questions broad proposals for profit sharing with artists in artificial intelligence art markets.
compensation_disagree_214,compensation,disagree,corporate_statement,The company expresses doubts about revenue sharing mandates tied to artificial intelligence art profits.
compensation_disagree_215,compensation,disagree,news_report,The article notes that some experts argue against creating large compensation schemes for artists affected by artificial intelligence.
compensation_disagree_216,compensation,disagree,legal_opinion,"The opinion suggests that artist compensation for artificial intelligence uses, if adopted, should be limited and narrowly targeted."
compensation_disagree_217,compensation,disagree,panel_discussion,Several panelists were skeptical of taxation plans that would redirect artificial intelligence art income to artists.
compensation_disagree_218,compensation,disagree,first_person,I would not insist on profit sharing for every artificial intelligence artwork that draws on my style.
compensation_disagree_219,compensation,disagree,policy_report,The report raises concerns about the complexity of administering artist royalties for artificial intelligence art systems.
compensation_disagree_220,compensation,disagree,academic_article,The paper criticizes expansive compensation frameworks tied to artificial intelligence training datasets.
compensation_neutral_221,compensation,neutral,research_report,"The report outlines several options for compensating artists when their work is used in artificial intelligence systems, without endorsing one."
compensation_neutral_222,compensation,neutral,first_person,"I am unsure how much compensation, if any, artists should receive when their art trains artificial intelligence models."
compensation_neutral_223,compensation,neutral,panel_discussion,"Our panel debated revenue sharing, lump sum payments, and public funds for artists affected by artificial intelligence art."
compensation_neutral_224,compensation,neutral,academic_article,The article analyzes possible compensation schemes for artists in relation to artificial intelligence generated works.
compensation_neutral_225,compensation,neutral,news_report,The news story presents contrasting proposals for paying artists when their work appears in artificial intelligence training data.
compensation_neutral_226,compensation,neutral,policy_brief,The brief describes models ranging from voluntary donations to statutory royalties for artificial intelligence art uses.
compensation_neutral_227,compensation,neutral,survey_report,Survey responses showed no clear consensus on whether artists should be paid when artificial intelligence uses their images.
compensation_neutral_228,compensation,neutral,blog_opinion,This post raises questions about fairness and feasibility in compensating artists for artificial intelligence training.
compensation_neutral_229,compensation,neutral,interview_artist,"In the interview, the artist says they are conflicted about whether to demand payment for artificial intelligence uses of their work."
compensation_neutral_230,compensation,neutral,legal_commentary,The commentary reviews proposed compensation frameworks for artists without supporting or rejecting them.
compensation_agree_231,compensation,agree,first_person,I generally believe that artists should receive some compensation when their work is used in artificial intelligence art systems.
compensation_agree_232,compensation,agree,blog_opinion,This essay argues that for profit companies ought to share a portion of artificial intelligence art revenues with creators.
compensation_agree_233,compensation,agree,policy_report,The report recommends that artists receive royalties when artificial intelligence products rely heavily on their work.
compensation_agree_234,compensation,agree,news_opinion,The column supports modest profit sharing schemes between artificial intelligence art platforms and contributing artists.
compensation_agree_235,compensation,agree,academic_article,The paper proposes a licensing model in which artists are paid when their art appears in artificial intelligence training sets.
compensation_agree_236,compensation,agree,panel_discussion,Several panelists agreed that it is fair to compensate artists whose work substantially informs artificial intelligence art outputs.
compensation_agree_237,compensation,agree,interview_artist,"In this interview, the illustrator says they prefer to donate some uses but expect payment when artificial intelligence art generates profit."
compensation_agree_238,compensation,agree,policy_brief,"The brief suggests a fund, financed by artificial intelligence art taxes, to support museums and human art making."
compensation_agree_239,compensation,agree,union_statement,The union calls for revenue sharing mechanisms to ensure artists benefit from artificial intelligence art markets.
compensation_agree_240,compensation,agree,advocacy_report,The advocacy report endorses compensation for artists whose works are systematically used to train artificial intelligence models.
compensation_strongly_agree_241,compensation,strongly_agree,first_person,I am convinced that artists must be compensated when their art is used in artificial intelligence training or products.
compensation_strongly_agree_242,compensation,strongly_agree,manifesto,This manifesto demands strong profit sharing and royalty rights for artists in all artificial intelligence art contexts.
compensation_strongly_agree_243,compensation,strongly_agree,union_statement,Our statement insists that no for profit company should earn from artificial intelligence art built on unpaid creative labor.
compensation_strongly_agree_244,compensation,strongly_agree,policy_report,The report strongly supports mandatory royalty schemes for artists whose work powers artificial intelligence art systems.
compensation_strongly_agree_245,compensation,strongly_agree,blog_opinion,This commentary argues that artists should receive a meaningful share of every artificial intelligence art sale derived from their work.
compensation_strongly_agree_246,compensation,strongly_agree,academic_article,The article advocates robust taxation of artificial intelligence art profits to fund grants for human artists and cultural institutions.
compensation_strongly_agree_247,compensation,strongly_agree,panel_statement,The panel's final statement calls for binding compensation rules whenever artificial intelligence art relies on existing artworks.
compensation_strongly_agree_248,compensation,strongly_agree,interview_artist,"In the interview, the painter says they would never consent to artificial intelligence training without clear payment and control."
compensation_strongly_agree_249,compensation,strongly_agree,policy_brief,The brief urges lawmakers to guarantee artists both royalties and public funding from artificial intelligence related revenues.
compensation_strongly_agree_250,compensation,strongly_agree,advocacy_report,The advocacy report describes uncompensated use of artists' work in artificial intelligence as exploitation that must be remedied.